{
  "contract_version": "1.0", "run": {"run_id": "negative-unknown", "execution_requested": false, "task_owned_mutation": false, "purpose": "negative fixture"},
  "policy": {"enforcement_level": "prompt-contract-only", "runtime_capacity": {"telemetry": "unknown", "value": 0}, "policy_cap": 1, "effective_cap": 0, "max_assignment_depth": 0},
  "state": {"current": "draft", "history": ["draft"]}, "budget": {"requested_slots": 0, "reserved_slots": 0}, "assignments": [], "exceptions": [],
  "fan_in": {"owner_assignment_id": null, "required_assignment_ids": [], "state": "pending"}, "review": {"independent_required": false, "state": "not-required", "evidence": "none"},
  "root_ownership": {"integration": "root", "external_mutation": "root", "review_of_review": "root", "closure": "root", "nested_delegation_authorizer_assignment_id": null}, "promotion": {"state": "not-requested", "proof": {"reference":"tests/test_runtime_delegation_semantics.py","verified":false}, "rollback": {"reference":"core/delegation/runtime-neutral-delegation.md","verified":false}}
}
