{"contract_version":"1.0","run":{"run_id":"no-grant","execution_requested":true,"task_owned_mutation":true,"purpose":"negative"},"policy":{"enforcement_level":"native","runtime_capacity":{"telemetry":"observed","value":2},"policy_cap":2,"effective_cap":2,"max_assignment_depth":2},"state":{"current":"draft","history":["draft"]},"budget":{"requested_slots":2,"reserved_slots":2},"assignments":[{"assignment_id":"root","kind":"root","role":"root","quality_class":"root-orchestration","objective":"x","dependencies":[],"parent_assignment_id":null,"nested_delegation_grant":{"state":"not-granted","authorized_by_assignment_id":null},"read_scopes":[],"write_scopes":[],"proof_requirement":"x","state":"draft","outcome":"pending"},{"assignment_id":"a","kind":"executor","role":"a","quality_class":"implementation-medium","objective":"x","dependencies":[],"parent_assignment_id":"root","nested_delegation_grant":{"state":"not-granted","authorized_by_assignment_id":null},"read_scopes":[],"write_scopes":[],"proof_requirement":"x","state":"draft","outcome":"pending"},{"assignment_id":"b","kind":"executor","role":"b","quality_class":"mechanical-medium","objective":"x","dependencies":[],"parent_assignment_id":"a","nested_delegation_grant":{"state":"not-granted","authorized_by_assignment_id":null},"read_scopes":[],"write_scopes":[],"proof_requirement":"x","state":"draft","outcome":"pending"}],"exceptions":[],"fan_in":{"owner_assignment_id":"root","required_assignment_ids":["a","b"],"state":"pending"},"review":{"independent_required":false,"state":"not-required","evidence":"x"},"root_ownership":{"integration":"root","external_mutation":"root","review_of_review":"root","closure":"root","nested_delegation_authorizer_assignment_id":"root"},"promotion":{"state":"not-requested","proof":{"reference":"tests/test_runtime_delegation_semantics.py","verified":false},"rollback":{"reference":"core/delegation/runtime-neutral-delegation.md","verified":false}}}
