{"contract_version":"1.0","run":{"run_id":"exception","execution_requested":false,"task_owned_mutation":false,"purpose":"x"},"policy":{"enforcement_level":"unsupported","runtime_capacity":{"telemetry":"unknown","value":null},"policy_cap":0,"effective_cap":0,"max_assignment_depth":0},"state":{"current":"exception","history":["draft","hardened","exception"]},"budget":{"requested_slots":0,"reserved_slots":0},"assignments":[],"exceptions":[{"code":"x","reason":"x","compensation":"x","state":"resolved"}],"fan_in":{"owner_assignment_id":null,"required_assignment_ids":[],"state":"pending"},"review":{"independent_required":false,"state":"not-required","evidence":"x"},"root_ownership":{"integration":"root","external_mutation":"root","review_of_review":"root","closure":"root","nested_delegation_authorizer_assignment_id":null},"promotion":{"state":"not-requested","proof":{"reference":"tests/test_runtime_delegation_semantics.py","verified":false},"rollback":{"reference":"core/delegation/runtime-neutral-delegation.md","verified":false}}}
