{"contract_version":"1.0","run":{"run_id":"unknown-parent","execution_requested":true,"task_owned_mutation":true,"purpose":"negative"},"policy":{"enforcement_level":"native","runtime_capacity":{"telemetry":"observed","value":1},"policy_cap":1,"effective_cap":1,"max_assignment_depth":1},"state":{"current":"draft","history":["draft"]},"budget":{"requested_slots":1,"reserved_slots":1},"assignments":[{"assignment_id":"root","kind":"root","role":"root","quality_class":"root-orchestration","objective":"root","dependencies":[],"parent_assignment_id":null,"nested_delegation_grant":{"state":"not-granted","authorized_by_assignment_id":null},"read_scopes":[],"write_scopes":[],"proof_requirement":"x","state":"draft","outcome":"pending"},{"assignment_id":"worker","kind":"executor","role":"worker","quality_class":"implementation-medium","objective":"work","dependencies":[],"parent_assignment_id":"missing","nested_delegation_grant":{"state":"not-granted","authorized_by_assignment_id":null},"read_scopes":[],"write_scopes":[],"proof_requirement":"x","state":"draft","outcome":"pending"}],"exceptions":[],"fan_in":{"owner_assignment_id":"root","required_assignment_ids":["worker"],"state":"pending"},"review":{"independent_required":false,"state":"not-required","evidence":"x"},"root_ownership":{"integration":"root","external_mutation":"root","review_of_review":"root","closure":"root","nested_delegation_authorizer_assignment_id":"root"},"promotion":{"state":"not-requested","proof":{"reference":"tests/test_runtime_delegation_semantics.py","verified":false},"rollback":{"reference":"core/delegation/runtime-neutral-delegation.md","verified":false}}}
