{"contract_version":"1.0","run":{"run_id":"bad","execution_requested":true,"task_owned_mutation":true,"purpose":"x"},"policy":{"enforcement_level":"native","runtime_capacity":{"telemetry":"observed","value":0},"policy_cap":0,"effective_cap":0,"max_assignment_depth":0},"state":{"current":"completed","history":["draft","hardened","tasks-ready","executing","fan-in","independent-review","root-review-of-review","completed"]},"budget":{"requested_slots":0,"reserved_slots":0},"assignments":[{"assignment_id":"root","kind":"root","role":"root","quality_class":"root-orchestration","objective":"x","dependencies":[],"parent_assignment_id":null,"nested_delegation_grant":{"state":"not-granted","authorized_by_assignment_id":null},"read_scopes":[],"write_scopes":[],"proof_requirement":"x","state":"executing","outcome":"failed"}],"exceptions":[],"fan_in":{"owner_assignment_id":"root","required_assignment_ids":[],"state":"complete"},"review":{"independent_required":false,"state":"not-required","evidence":"x"},"root_ownership":{"integration":"root","external_mutation":"root","review_of_review":"root","closure":"root","nested_delegation_authorizer_assignment_id":"root"},"promotion":{"state":"approved","proof":{"reference":"tests/test_runtime_delegation_semantics.py","verified":true},"rollback":{"reference":"core/delegation/runtime-neutral-delegation.md","verified":true}}}
