{"contract_version":"1.0","run":{"run_id":"completed","execution_requested":true,"task_owned_mutation":true,"purpose":"closure proof"},"policy":{"enforcement_level":"native","runtime_capacity":{"telemetry":"observed","value":1},"policy_cap":1,"effective_cap":1,"max_assignment_depth":1},"state":{"current":"completed","history":["draft","hardened","tasks-ready","executing","fan-in","independent-review","root-review-of-review","completed"]},"budget":{"requested_slots":1,"reserved_slots":1},"assignments":[{"assignment_id":"root","kind":"root","role":"root","quality_class":"root-orchestration","objective":"close","dependencies":[],"parent_assignment_id":null,"nested_delegation_grant":{"state":"not-granted","authorized_by_assignment_id":null},"read_scopes":[],"write_scopes":[],"proof_requirement":"closure","state":"completed","outcome":"succeeded"},{"assignment_id":"worker","kind":"executor","role":"worker","quality_class":"implementation-medium","objective":"work","dependencies":[],"parent_assignment_id":"root","nested_delegation_grant":{"state":"not-granted","authorized_by_assignment_id":null},"read_scopes":[],"write_scopes":[],"proof_requirement":"test","state":"completed","outcome":"succeeded"}],"exceptions":[],"fan_in":{"owner_assignment_id":"root","required_assignment_ids":["worker"],"state":"complete"},"review":{"independent_required":true,"state":"passed","evidence":"tests/test_runtime_delegation_semantics.py"},"root_ownership":{"integration":"root","external_mutation":"root","review_of_review":"root","closure":"root","nested_delegation_authorizer_assignment_id":"root"},"promotion":{"state":"approved","proof":{"reference":"tests/test_runtime_delegation_semantics.py","verified":true},"rollback":{"reference":"core/delegation/runtime-neutral-delegation.md","verified":true}}}
