{"contract_version":"1.0","run":{"run_id":"bad-exception","execution_requested":false,"task_owned_mutation":false,"purpose":"negative"},"policy":{"enforcement_level":"native","runtime_capacity":{"telemetry":"observed","value":0},"policy_cap":0,"effective_cap":0,"max_assignment_depth":0},"state":{"current":"completed","history":["draft","hardened","tasks-ready","executing","fan-in","independent-review","root-review-of-review","completed"]},"budget":{"requested_slots":0,"reserved_slots":0},"assignments":[],"exceptions":[{"code":"x","reason":"x","compensation":"x","state":"open"}],"fan_in":{"owner_assignment_id":null,"required_assignment_ids":[],"state":"complete"},"review":{"independent_required":true,"state":"passed","evidence":"x"},"root_ownership":{"integration":"root","external_mutation":"root","review_of_review":"root","closure":"root","nested_delegation_authorizer_assignment_id":null},"promotion":{"state":"approved","proof":{"reference":"tests/test_runtime_delegation_semantics.py","verified":true},"rollback":{"reference":"core/delegation/runtime-neutral-delegation.md","verified":true}}}
