{
  "contract_version": "1.0",
  "run": {"run_id": "semantic-core-positive", "execution_requested": true, "task_owned_mutation": true, "purpose": "validate portable delegation meaning"},
  "policy": {"enforcement_level": "adapter-enforced", "runtime_capacity": {"telemetry": "observed", "value": 2}, "policy_cap": 2, "effective_cap": 2, "max_assignment_depth": 1},
  "state": {"current": "fan-in", "history": ["draft", "hardened", "tasks-ready", "dispatch-required", "dispatched", "executing", "fan-in"]},
  "budget": {"requested_slots": 2, "reserved_slots": 2},
  "assignments": [
    {"assignment_id": "root", "kind": "root", "role": "root", "quality_class": "root-orchestration", "objective": "own closure", "dependencies": [], "parent_assignment_id": null, "nested_delegation_grant": {"state": "not-granted", "authorized_by_assignment_id": null}, "read_scopes": ["core/"], "write_scopes": [], "proof_requirement": "integration review", "state": "fan-in", "outcome": "pending"},
    {"assignment_id": "implement", "kind": "executor", "role": "implementer", "quality_class": "implementation-medium", "objective": "implement bounded change", "dependencies": [], "parent_assignment_id": "root", "nested_delegation_grant": {"state": "not-granted", "authorized_by_assignment_id": null}, "read_scopes": ["core/"], "write_scopes": ["core/"], "proof_requirement": "focused test", "state": "executing", "outcome": "pending"},
    {"assignment_id": "review", "kind": "reviewer", "role": "reviewer", "quality_class": "review-medium", "objective": "review evidence", "dependencies": ["implement"], "parent_assignment_id": "root", "nested_delegation_grant": {"state": "not-granted", "authorized_by_assignment_id": null}, "read_scopes": ["core/"], "write_scopes": [], "proof_requirement": "adversarial review", "state": "fan-in", "outcome": "pending"}
  ],
  "exceptions": [], "fan_in": {"owner_assignment_id": "root", "required_assignment_ids": ["implement", "review"], "state": "pending"},
  "review": {"independent_required": true, "state": "pending", "evidence": "awaiting review receipt"},
  "root_ownership": {"integration": "root", "external_mutation": "root", "review_of_review": "root", "closure": "root", "nested_delegation_authorizer_assignment_id": "root"},
  "promotion": {"state": "not-requested", "proof": {"reference": "tests/test_runtime_delegation_semantics.py", "verified": false}, "rollback": {"reference": "core/delegation/runtime-neutral-delegation.md", "verified": false}}
}
